Unnamed: 0,abstract,top_journal
983,"We analyze data 2005 2009 uniquely identify categories traders assess speculators hedge funds swap dealers relate volatility price changes . Examining various subperiods price trends strong , find little evidence speculators destabilize financial markets . To contrary , hedge funds facilitate price discovery trading contemporaneous returns serving reduce volatility . Swap dealer activity , however , largely unrelated contemporaneous returns volatility . Our evidence consistent hypothesis hedge funds provide valuable liquidity largely serve stabilize futures markets . ( This abstract borrowed another version item . )",0
984,"We examine asset allocation decisions smooth ambiguity aversion investor prior degree belief asset pricing model ( e.g. , domestic CAPM ) . Different Bayesian portfolio approach , model investor separately relies conditional distribution returns posterior uncertain parameters make asset allocation decisions , rather predictive distribution returns integrates priors likelihood information single distribution . This key feature implied smooth ambiguity preferences . We find perspective US investors , ambiguity aversion generate strong home bias equity holdings , regardless belief domestic CAPM degree risk aversion . Our results extend become stronger regime-switching investment opportunities . JEL Classification : C61 ; D81 ; G11 . Keywords : Ambiguity aversion , Bayesian portfolio analysis , CAPM , Smooth ambiguity . ( This abstract borrowed another version item . )",0
985,"We test presence systematic tail risk premium cross-section expected returns applying measure sensitivity assets extreme market downturns , tail beta . Empirically , historical tail betas help predict future performance stocks extreme market downturns . During market crash , stocks historically high tail betas suffer losses approximately 2 3 times larger low tail beta counterparts . However , find evidence premium associated tail betas . The theoretically additive empirically persistent tail betas help assess portfolio tail risks . ( This abstract borrowed another version item . )",0
986,"Using 57-year global panel listings foreign stock exchanges , identify waves foreign listing activity host market , home market , industry levels . We observe waves host market often due cross-listing waves home markets industries share particular affiliation respective host market . We find cross-listing waves given host country given home country largely coincide outperformance country?s economy financial markets relative competing markets . We also show firms list shares waves associated temporary value premium . Our results provide novel evidence non-monotonic market development across countries time . ( This abstract borrowed another version item . )",0
987,"We analyze profitability government-owned banksâ?? lending owners , using unique data set relatively homogeneous government-owned banks ; banks owned similarly structured local governments single country . Making use natural experiment altered regulatory competitive environment , find evidence lending used transfer revenues banks governments . Some evidence particularly pronounced localities incumbent politicians face significant competition reelection . ( This abstract borrowed another version item . )",0
988,"This paper studies role credit business cycle , focus private credit overhang . Based study universe 200 recession episodes 14 advanced countries 1870 2008 , document two key facts modern business cycle : financial-crisis recessions costly normal recessions terms lost output ; types recession , credit-intensive expansions tend followed deeper recessions slower recoveries . In addition unconditional analysis , use local projection methods condition broad set macroeconomic controls lags . Then study past credit accumulation impacts behavior output , also key macroeconomic variables investment , lending , interest rates , inflation . The facts uncover lend support idea nancial factors play important role modern business cycle . ( This abstract borrowed another version item . )",0
989,"Estimating effect Federal Reserve 's announcements Large-Scale Asset Purchase ( LSAP ) programs corporate credit risk complicated simultaneity policy decisions movements prices risky financial assets , well fact interest rates assets targeted programs indicators credit risk reacted common shocks recent financial crisis . This paper employs heteroskedasticity-based approach estimate structural coefficient measuring sensitivity market-based indicators corporate credit risk declines benchmark market interest rates prompted LSAP announcements . The results indicate LSAP announcements led significant reduction cost insuring default risk -- measured CDX indexes -- investment- speculative-grade corporate credits . While unconventional policy measures employed Federal Reserve stimulate economy substantially lowered overall level credit risk economy , LSAP announcements appear measurable effect credit risk financial intermediary sector . ( This abstract borrowed another version item . )",0
990,"We analyze optimal monetary policy model two distinct financial frictions . First , borrowing subject collateral constraints . Second , credit flows intermediated monopolistically competitive banks , thus giving rise endogenous lending spreads . We show , second order approximation , welfare maximization equivalent stabilization four goals : inflation , output gap , consumption gap constrained unconstrained agents , distribution collateralizable asset groups . Following financial non-financial shocks , optimal monetary policy commitment implies short-run trade-off stabilization goals . Such policy tradeoffs become amplified banking competition increases , due fall lending spreads resulting increase financial leveraging . ( This abstract borrowed another version item . )",0
991,"This paper analyzes transmission mechanism banking sector shocks international real business cycle model heterogeneous bank sizes . We examine extent financial exposure banking sector affects transmission foreign banking sector shocks . In model , exposed domestic banks foreign economy via lending foreign firms , greater spillovers foreign financial shocks home economy . The model highlights role openness trade dynamics terms trade international transmission mechanism banking sector shocks Spillovers foreign banking sector shocks greater open home economy trade less terms trade respond foreign shocks . ( This abstract borrowed another version item . )",0
992,"This paper estimates two-country model global bank , using US Euro Area ( EA ) data , Bayesian methods . The estimated model matches key US EA business cycle statistics . Empirically , model version bank capital requirement outperforms structure without constraint . A loan loss originating one country triggers global output reduction . Banking shocks matter EA macro variables US real activity . During Great Recession ( 2007-09 ) , banking shocks accounted 20 % fall US EA GDP , half fall EA investment employment . ( This abstract borrowed another version item . )",0
993,"We evaluate two popular approaches implementing financial frictions DSGE models : Bernanke et al . ( 1999 ) setup , financial frictions enter price loans , Kiyotaki Moore ( 1997 ) model , concern quantity loans . We take models US data check well fit several margins . Overall , comparing models favors framework Bernanke et al . ( 1999 ) . However , even model able make clear improvement benchmark New Keynesian model , Kiyotaki Moore ( 1997 ) underperforms several margins . Furthermore , none extensions explains 2007-09 recession significantly ?financial? several previous ones . ( This abstract borrowed another version item . )",0
994,"Recent work optimal monetary fiscal policy New Keynesian models suggests optimal allow steady-state debt follow random walk . Leith Wren-Lewis ( 2012 ) consider nature timeinconsistency involved policy implication discretionary policy-making . We show governments tempted , given inflationary expectations , utilize monetary fiscal instruments initial period change ultimate debt burden need service . We demonstrate temptation eliminated following shocks , new steady-state debt equal original ( efficient ) debt level even though explicit debt target governmentâ??s objective function . Analytically series numerical simulations show instrument used stabilize debt depends crucially degree nominal inertia size debt-stock . We also show welfare consequences introducing debt negligible precommitment policies , significant discretionary policy . Finally , assess credibility commitment policy considering quasi-commitment policy allows different probabilities reneging past promises . This on-line Appendix extends results paper . ( This abstract borrowed another version item . )",0
995,"This paper studies consequences labor-market frictions real effects steady inflation cash required households ' consumption purchases firms ' wage payments . Money growth may generate positive real effect encouraging vacancy creation raising job matches . This may result positive optimal rate inflation , particularly economy moderate money injections firms nonnegligible labor-market frictions wage bargains efficient . This main finding holds wide range money injection schemes , alternative cash constraints , second-best world pre-existing distortionary taxes . ( This abstract borrowed another version item . )",0
996,"We argue New-Keynesian Phillips Curve literature failed deliver convincing measure real marginal costs . We start careful modeling optimal price setting allowing non-unitary factor substitution , non-neutral technical change time-varying factor utilization rates . This ensures resulting real marginal cost measures match volatility reductions level changes witnessed many US time series . The cost measure comprises conventional counter-cyclical cost elements plus pro-cyclical ( co-varying ) utilization rates . Although pro-cyclical elements seem dominate , components real marginal cost components becoming less cyclical time . Incorporating richer driving variable produces plausible price-stickiness estimates otherwise suggests balanced weight backward forward-looking inflation expectations commonly found . Our results challenge existing views inflation determinants important implications modeling inflation New-Keynesian models . ( This abstract borrowed another version item . )",0
997,"The substantial fluctuations house prices recently experienced many industrialized economies stimulated vivid debate possible implications monetary policy . In paper , ask whether U.S. Fed , Bank Japan Bank England reacted house prices . We study responses central banks estimating structural model country credit constrained agents borrow real estate . The main result house price movements play separate role U.S. , U.K.. Japanese central bank reaction functions . ( This abstract borrowed another version item . )",0
998,"We examine role commercial banks monetary transmission factor-augmented vector autoregression ( FAVAR ) . A FAVAR exploits large number macroeconomic indicators identify monetary policy shocks , add commonly used lending aggregates lending data bank level . While results suggest bank lending channel ( BLC ) stronger previously thought , feature robust . In addition , results indicate diffuse response monetary innovations individual banks grouped according asset sizes loan components . This suggests bank characteristics could improve identification BLC . ( This abstract borrowed another version item . )",0
999,"This paper empirically analyzes exchange rate policy affects issuance pricing international bonds developing countries . We find countries less flexible exchange rate regimes pay higher sovereign bond spreads less likely issue bonds . Quantitatively , changing free-floating regime fixed regime decreases likelihood bond issuance 4.6 % increases bond spread 1.3 % average . Furthermore , countries real exchange rate overvaluation higher bond spreads higher bond issuance probabilities . Moreover , positive effects real exchange rate overvaluation tend magnified countries fixed exchange rate regimes . Our results suggest choosing less flexible exchange rate regime general leads higher borrowing costs developing countries , especially currencies overvalued . ( This abstract borrowed another version item . )",0
1000,"I characterize optimal monetary fiscal policy stochastic New Keynesian model nominal interest rates may occasionally hit zero lower bound . The benevolent policymaker controls short-term nominal interest rate level government spending . Under discretionary policy , accounting fiscal stabilization policy eliminates large extent welfare losses associated presence zero bound . Under commitment , gains associated use fiscal policy tool remain modest , even though fiscal stabilization policy part optimal policy mix . ( This abstract borrowed another version item . )",0
1001,"In paper argue banks anticipate short-term market rates setting interest rates loans deposits . In order include anticipated rates empirical model , use two methods forecast market rates - level , slope , curvature model principal components model - including model retail rate adjustment four retail rates four major euro area economies . Using aggregate data data individual French banks , find significant role forecasts market rates determining retail rates ; alternative specifications futures information yield comparable results . ( This abstract borrowed another version item . )",0
1002,"Output responses oil-price shocks tend weaker , also peak earlier recently . This paper builds model incorporates realistic structure US petroleum consumption explores three possible explanations changes . The first based deregulation transportation sector , brought competition improved efficiency industry . The second overall improve- ments use energy . The third less persistence oil-price shock . Under realistic parameter values , demonstrated three factors play important role quantitatively . These three factors together could account 51 % reduction peak response output oil-price shock . ( This abstract borrowed another version item . )",0
1003,"Staggered prices fundamental building block New Keynesian dynamic stochastic general equilibrium models . In standard model , prices uniformly staggered recent empirical evidence suggest deviations uniform staggering common , This paper analyzes synchronization price changes affects response monetary policy shocks . I find even large deviations uniform staggering small effects response output . Aggregate dynamics model uniform staggering may serve well approximation complicated model degree synchronization price setting . ( This abstract borrowed another version item . )",0
1004,"Abstract : This paper examines nexus news coverage inflation households ' inflation expectations . In , test epidemiological foundations sticky information model ( Carroll , 2003 , 2006 ) . We use aggregate household-level data Survey Research Center University Michigan . We highlight fundamental disconnection news inflation , consumers ' frequency expectation updating accuracy expectations . Our evidence provides best weak support epidemiological framework , consumers update expectations revise towards professional forecasters ' mean forecast . ( This abstract borrowed another version item . )",0
1005,"This paper shows house price fluctuations significant impact credit markets well beyond mortgage segment . Using new data Prosper.com , peer peer lending site matches borrowers lenders provide unsecured consumer loans , find evidence home owners states declining house prices face higher interest rates greater rationing credit , also becoming delinquent faster . Investigating mechanism , find separate supply demand effects , especially large effects subprime borrowers whose balance sheets likely exposed asset price declines . This evidence suggests asset price fluctuations play important part determining credit conditions thus potentially significant mechanism propagating macroeconomic shocks . ( This abstract borrowed another version item . )",0
1006,"This first paper literature match key business cycle moments long-run equity returns small open economy production . These results achieved introducing three modications standard real business cycle model : ( 1 ) borrowing lending costs imposed increase volatility intertemporal marginal rate substitution ; ( 2 ) investment adjustment costs assumed make equity returns volatile ; ( 3 ) GHH preferences employed smooth consumption . We also decompose contributions productivity , world interest rate , government expenditure shocks equity premium . Our results based data Argentina , Brazil , Chile . ( This abstract borrowed another version item . )",0
1007,"Using multi-country panel banks , study whether better capitalized banks experienced higher stock returns financial crisis . We differentiate among various types capital ratios : Basel risk-adjusted ratio ; leverage ratio ; Tier I Tier II ratios ; tangible equity ratio . We find several results : ( ) crisis , differences capital much impact stock returns ; ( ii ) crisis , stronger capital position associated better stock market performance , markedly larger banks ; ( iii ) relationship stock returns capital stronger capital measured leverage ratio rather risk-adjusted capital ratio ; ( iv ) higher quality forms capital , Tier 1 capital tangible common equity , relevant . ( This abstract borrowed another version item . )",0
1008,"How asymmetry labor market institutions affect adjustment currency union shocks ? To answer question , paper sets dynamic currency union model monopolistic competition sticky prices , hiring frictions real wage rigidities . In analysis , focus differentials inflation unemployment countries , directly reflect currency union responds shocks . We highlight following three results : First , show important distinguish different labor market rigidities opposite effects inflation unemployment differentials . Second , find asymmetries labor market structures tend increase volatility inflation unemployment differentials . Finally , show important take account interaction different types labor market rigidities . Overall , results suggest asymmetries labor market structures worsen adjustment currency union shocks . ( This abstract borrowed another version item . )",0
1009,"Public deficit figures subject revisions , macroeconomic aggregates . Nevertheless , case Europe , latter could particularly worrisome given role fiscal data functioning EU?s multilateral surveillance rules . Adherence rules judged upon initial releases data , framework so-called Excessive Deficit Procedure ( EDP ) Notifications . In addition , lack reliability fiscal data may hinder credibility fiscal consolidation plans . In paper document empirical properties revisions annual government deficit figures Europe exploiting information contained pool real-time vintages data pertaining fifteen EU countries period 1995-2008 . We build real-time dataset official publications . Our main findings follows : ( ) preliminary deficit data releases biased non-efficient predictors subsequent releases , later vintages data tending show larger deficits average ; ( ii ) systematic bias deficit revisions general feature sample , solely attributed behaviour small number countries , even though Greek case clearly outlier ; ( iii ) Methodological improvements clarifications stemming Eurostat?s decisions may lead data revisions explain significant share bias , providing evidence window dressing side individual countries ; ( iv ) expected real GDP growth , political cycles strength fiscal rules also contribute explain revision patterns ; ( v ) nevertheless , systematic bias excluded , revisions considered rational two years . ( This abstract borrowed another version item . )",0
1010,"This paper employs newly constructed measures productivity differentials , external imbalances , commodity terms trade estimate panel cointegrating relationship real exchange rates set fundamentals sample 48 industrial countries emerging markets . It finds evidence strong positive relation CPI-based real exchange rate commodity terms trade . The estimated impact productivity growth differentials traded nontraded goods , statistically significant , small . Increases net foreign assets government consumption tend associated appreciating real exchange rates . ( This abstract borrowed another version item . )",0
1011,"We present unique empirical analysis properties New Keynesian Phillips Curve using international dataset aggregate disaggregate sectoral ation . Our results panel time-series estimation clearly indicate sectoral heterogeneity important consequences aggregate ation behaviour . Heterogeneity helps explain overestimation ation persistence underestimation role marginal costs empirical investigations NKPC use aggregate data . We nd combining disaggregate information heterogeneous-consistent estimation techniques helps reconcile , large extent , NKPC data . ( This abstract borrowed another version item . )",0
1012,"The conventional dividend-price ratio highly persistent , literature reports mixed evidence role predicting stock returns . In particular , predictive power seems sensitive choice sample period . We argue decreasing number firms traditional dividend-payout policy responsible results , develop model long-run relationship dividends stock price time-varying . An adjusted dividend-price ratio accounts time-varying long-run relationship stationary considerably less persistence conventional dividend-price ratio . Furthermore , predictive regression model employs adjusted dividend-price ratio regressor outperforms random-walk model terms long-horizon out-of-sample predictability . These results robust respect firm size . ( This abstract borrowed another version item . )",0
1013,"Using 10 years high-frequency foreign exchange data , present evidence time-of-day effects foreign exchange returns significant tendency currencies depreciate local trading hours . We confirm pattern across range currencies find , case EUR/USD , form simple , profitable trading strategy . We also find pattern present order flow suggest patterns relate tendency market participants net purchasers foreign exchange trading hours . Data alternative sources appear corroborate interpretation . ( This abstract borrowed another version item . )",0
1014,"This paper empirically investigates impact changes US real interest rates sovereign default risk emerging economies using method identification heteroskedasticity . Policy-induced increases US interest rates starkly raise default risk emerging market economies . However , overall correlation US real interest rates risk default negative , demonstrating effects variables dominate anterior relationship ( This abstract borrowed another version item . )",0
1015,We derive first closed-form optimal mortgage refinancing rule . The expression derived using Lambert-W function solve tractable class mortgage refinancing problems . We calibrate solution show quantitative results closely match reported researchers use numerical methods . ( This abstract borrowed another version item . ) ( This abstract borrowed another version item . ),0
1016,"Freeman ( 1999 ) proposes model discount window lending open market operations different effects . This important literature , policies indistinguishable . However , Freeman 's argument central bank absorb losses associated default provide risk-sharing stands stark contrast concern central banks limit exposure credit risk . We extend Freeman 's model introducing moral hazard . With moral hazard , central bank avoid absorbing losses Freeman 's argument breaks . However , show policies resembling discount window lending open market operations still distinguished new framework . The optimal policy central bank make restricted number creditors compete funds . By restricting number agents , central bank limit moral hazard problem . By making compete , central bank exploit market information reveals state economy . ( This abstract borrowed another version item . )",0
1017,"This paper analyses competitive effects capital requirement regulation oligopolistic credit market . In first stage , banks choose structure refinancing assets , thereby making imperfect commitment loan capacity function chosen degree capitalization regulatory capital requirement . In second stage , loan price competition takes place . It shown capital requirement regulation may decrease supply credit increased marginal cost effect additional collusive enhancing effect resulting even higher credit prices increased profits banks . ( This abstract borrowed another version item . )",0
1018,"The authors study optimal monetary policy model fiat money private debt coexist means payment . The credit system endogenous allows buyers relax cash constraints . However , costly agents publicly report trades , necessary enforcement private liabilities . If costly government obtain information regarding private transactions , relies public information generated private credit system . If private transactions publicly reported , government imperfect public information implement monetary policy . In case , authors show incentive-feasible policy implement socially efficient allocation . Finally , characterize optimal policy economy low record-keeping cost large number public transactions , results positive long-run inflation rate . ( This abstract borrowed another version item . )",0
