Unnamed: 0,abstract,top_journal
378,"Economists increasingly studying market charitable giving , including behavioral aspects . In `` identifiable victim effect '' people donate help identified individuals groups . However , individuals socially low-ranking groups may prompt similar charity . The continuing depth caste-based prejudice contemporary India widely debated . We report three randomized experiments conducted computer-using Indian participants . First , conducted survey experiment detailed information participants . Second , experimentally varied 56,000 real advertisements charitable donations shown online . Third , conducted Internet choice experiment participants allocated real money . In three studies identification treatment crossed population group membership recipient . We indicate population group membership identified recipients subtly , using names connote caste ; participants ' understanding names verified separate experimental sample . In studies , find identifiable victim effect generic Indian high-caste recipients , absent even reversed low-caste recipients . Caste still matters among Internet-using , English-speaking population participants .",0
379,"Significant income gains migrating poorer richer countries motivated unilateral ( source-country ) policies facilitating labor emigration . However , effectiveness unknown . We conducted large-scale randomized experiment Philippines testing impact unilaterally facilitating international labor migration . Our intensive treatment doubled rate job offers identifiable effect international labor migration . Even highest overseas job-search rate induced ( 22 % ) , falls far short share initially expressing interest migrating ( 34 % ) . We conclude unilateral migration facilitation induce trickle , flood , additional emigration .",0
380,"This article examines role education family background age marriage , age first birth , age labor market entry young Senegalese women . We use multiple-equation framework allows us account endogeneity arises simultaneity four decisions model . Our results highlight importance woman 's education delaying marriage relationship education timing childbearing entering labor market mainly operates influence schooling decisions age marriage . We show marriage motherhood decisions interrelated timing first birth strongly depends duration marriage . We also shed light composite influence parental education death shocks outcomes examine .",0
381,"Worldwide , 2.5 billion people lack access basic sanitation , situation contributes 2 million annual diarrhea-related child deaths substantial morbidity . Yet rigorous evaluations sanitation behaviors health welfare impacts rare . This article uses randomized sanitation promotion campaign Orissa , India , evaluate child health household welfare outcomes . The sanitation campaign increased households ' ownership use latrines improved children 's mid-upper-arm circumference , height , weight z-scores . Switching open defecation latrine use also saved time increased satisfaction sanitation conditions . We use results illustrate cost-benefit calculus underlying seemingly unglamorous mundane household choice potentially large environmental externalities .",0
382,"Total fertility rates sub-Saharan Africa nearly double region world . Some argue providing contraceptives negligibly small impact fertility . I exploit exogenous , temporary reductions contraceptive supply Ghana , resulting cuts US funding , examine impacts pregnancy , abortion , births . Women unable fully compensate 10 % -16 % supply reduction using traditional methods preventing pregnancy , increases 10 % . Only nonpoor women offset unwanted pregnancies induced abortion . Using separate data , I find poor women experience increases realized fertility 7 % -10 % .",0
383,"We develop model regulation service-delivery nongovernmental organizations ( NGOs ) , future grants conditional prior spending minimal proportion current revenue direct project-related expenses . Such regulation induces NGOs increase current project spending imposes wasteful costs compliance verification NGOs . Under large class parametric configurations , find regulation increases total discounted project expenditure regime regulation , verification costs constitute 15 % initial revenue . We characterize optimal regulatory policy configurations . We apply analysis large sample NGOs Uganda find regulation beneficial context .",0
384,"We show armed conflict Uganda affects civic participation , measured frequency political discussion local meeting attendance . Relying four rounds nationally representative individual-level data civic participation bracketing large number battle events , find civic participation increases districts battle events took place . Evidence variety identification strategies , including difference-in-difference IV estimates , suggest relationship causal . However , unlike previous studies , find experiencing violence affect formal electoral participation .",0
385,"A vibrant literature emerged explores economic implications sex ratio ( ratio men women population ) , including changes fertility rates , educational outcomes , labor supply , household purchases . Previous empirical efforts , however , paid less attention underlying channel via changes sex ratio affect economic decisions . This study combines evidence field experiment survey document sex ratio importantly influences female bargaining power : sex ratio increases , female bargaining power increases .",0
386,"Increasing access sex-selective abortions societies male preference , theoretically , increase average level investments care provided girls aborted . Existing literature finds higher birth order sex selection increased legalization abortion Taiwan . This research presents evidence legalization abortion Taiwan improved average rate university attendance girls born higher birth orders sex selection common . Specifically , I find girls born higher birth orders legalization abortion average likely attend university approximately 4.5 percentage points . Moreover , similar improvement university attendance rates higher birth order boys found . Heterogeneous results indicate families relatively lower socioeconomic status likely driving results . The findings analysis robust several specifications , extend existing literature providing evidence substitution hypothesis later-life economic outcome .",0
387,"This article examines different organizational structures disaster aid delivery affect house aid quality . We analyze three waves survey data fishermen fishing villages Aceh , Indonesia , following 2004 tsunami . We categorize four organizational structures based whether donors contract aid implementation . Compared bilateral contracting donors implementers , donors vertically integrate implementation offer highest-quality housing rated village heads fewer counts faults , leaky roofs cracked walls , reported fishermen . However , shade quality lose dominance leading aid agency village . Domestic implementers government agency responsible significant portions aid delivery provide significantly lower-quality aid . We also examine imposition shared ownership , primary social agenda boat aid agencies , affects boat aid quality . We find village fishing leaders steer poor-quality boats toward shared ownership imposed upon , often lower-status fishermen .",0
388,"For young adults living countries AIDS epidemics , getting HIV test may influence near-term decisions , leave school , marry , first child . These behaviors , define transition adolescence adulthood , long-term implications well-being directly affect person 's risk contracting HIV . Using experimental design embedded panel survey Malawi , study assesses HIV voluntary counseling testing young adults affects decisions . The results show negligible intent-to-treat effect HIV testing behaviors . There suggestive evidence , however , differential response wealth prior beliefs one 's HIV status .",0
389,"We estimate effect 70 Más , age-conditioned cash transfer program individuals age 70 older rural Mexico , labor force participation beneficiaries younger individuals live . Using data 2010 Mexican census , exploit age locality population thresholds identify effects program , time operated localities less 30,000 inhabitants . We find program reduces labor force participation elderly men , particularly live alone relatively poor , much weaker effect elderly women . The program statistically significant effect labor force participation either prime-age men women live potential beneficiaries , negative significant effect labor force participation boys age 12-17 , particularly lowest wealth quintiles , same-age girls . These results suggest program affects mostly labor supply intended beneficiaries marginal workers , like adolescent boys .",0
390,"Employee referral often thought exist conveys positive information unobserved worker quality helps monitoring workers . Using data compiled army archives , test whether referral system use British colonial army Ghana associated higher quality effort new recruits . We find : referred recruits likely unreferred recruits desert dismissed `` inefficient '' `` unfit '' `` misconduct . '' We find instead evidence referee opportunism . The fact referred recruits better observed characteristics time recruitment suggests army recruiters may aware problem sought compensate lower-than-average unobserved quality .",0
391,"The education poor disadvantaged populations , particularly minority subgroups , long-standing challenge education systems developed developing countries . One reason underperformance ethnic minority students might low competency language wider communication ( LWC ) . This article uses randomized field experiment 57 schools ( 26 treatment schools 31 control schools ) examine impact LWC learning program overall academic performance ( outcomes ) students limited competency LWC . This computer assisted learning program teaches rural ethnic minority students northwestern China Mandarin skills . Results show LWC-enhancing program improves student test scores Mandarin language subject 0.14-0.20 standard deviations also improves student math test scores 0.22-0.23 standard deviations , possibly via improved language competency . It also positive effects student nonacademic outcomes self-efficacy studying Mandarin . Low-performing students benefit program .",0
392,"The conventional wisdom devastation wrought 1995 Kobe ( Great Hanshin-Awaji ) earthquake long-term impact Japanese economy , much impact Kobe , wrong . We reevaluate evidence using new methodology , synthetic control , find persistent still continuing adverse impact quake economy Kobe decade event . Using methodology developed Abadie et al . ( Journal American Statistical Association , 2010 ) , construct counterfactual dynamics Kobe economy . We identify decline per capita GDP attributable quake persistent , long-term , clearly observable even 13 years quake . GDP per capita 2008 ¥400,000 per person lower ( 12 % decrease ) would earthquake occurred . Importantly , adverse long-term impact identified wealthy region high-income country backing deep-pocketed fiscal authority .",0
393,"There considerable debate whether social protection programs providing transfers households create disincentives labor supply , little attention paid effect programs forms labor reallocation . This article estimates impact Brazil 's Bolsa Família program several dimensions household labor supply , using propensity-score-weighted regression . We find disincentive effects aggregate household labor supply large effects labor allocation sectors across household members . The program causes substantial reallocation labor hours formal- informal-sector work . We argue shift plausibly induced program 's use formal-sector income determine means-tested eligibility . The shift toward informal work observed urban areas , rural areas -- pattern consistent larger formal/informal wage differentials rural areas . We also find reallocation labor hours females males rural households , potentially mixed implications rural women 's time burden decision-making power .",0
394,"This article assesses importance social interactions determining individual 's choice connect electrical grid , using original data set new rural electrification program Ethiopia . Combining global positioning system information random allocation discount vouchers connection grid , show neighbors ' connection behaviors large effects household 's connection decision . This effect also shown decrease distance : peer effect found neighbors living farther 100 meters away . Evidence also suggests expectation interactions ( social learning benefits electricity ) constraint interactions ( direct externalities one 's connection others ' well-being ) unlikely fully account effects preference interactions ( `` keeping neighbors '' type mechanism ) appear plausible explanation . We discuss implications research design development interventions .",0
395,"I exploit unexpected increase employment 1975 , 1976 , 1977 South African homelands compare long-term adult outcomes children whose fathers benefited employment increase . Using standard difference-in-difference approach , I find shock affected males either newborn utero time , providing support fetal-origins hypothesis showing importance mother 's nutrition . The income increases raise household income poverty datum line , explaining older individuals affected . This study provides previously unmeasured individual-level information quality life homelands apartheid , era African living standards neglected unmeasured lack data collection .",0
396,"This article empirically investigates whether differences region 's taxation burden basis support centralized state government Indian state Andhra Pradesh . Using randomness introduced close election outcomes , article finds government collected less tax revenues opposition parties successful . The decline tax revenue likely targeted agricultural producers , similar pattern found available agricultural policies . These results consistent model optimal centralized government catch elections trails opposed bolstering existing leads . Furthermore , results suggest taxation responds electoral pressures agricultural producers particular targeted times political competition .",0
397,"This article empirically examines causal effect railway infrastructure local economic development using construction Qingzang railway natural experiment . We apply difference-in-difference method find Qingzang railway significantly stimulated economy counties along path ( railway counties ) . The local GDP per capita increased 33 % railway begun operate . The effect manifested primarily positive railway effect manufacturing industry . In addition , effect vary significantly initial economic status railway counties . The GDP per capita off-railway counties adjacent railway counties significantly affected .",0
398,"This article analyzes whether children born teen mothers Cape Town , South Africa , disadvantaged terms health outcomes mother teen . Exploiting longitudinal nature Cape Area Panel Study , assess whether observable differences teen mothers slightly older mothers explain firstborn children teen mothers appear disadvantaged . Our balanced regressions indicate observed characteristics explain full extent disadvantage born teen mother , children born teen mothers continuing significantly worse child health outcomes , especially among Coloured children . In particular , children born teens likely underweight birth stunted , disadvantage Coloured children four times African children .",0
399,"Before 2005 , states India gave sons legal right inherit parents ' ancestral land . However , five states India legal reforms giving daughters inheritance rights sons . This article examines impact reforms female child mortality fertility . A model shows parents desire maximize bequest per son , giving daughters inheritance rights increases cost daughters , causing parents reduce investment daughters ' health decrease fertility . A difference-in-difference analysis shows reforms caused increase female child mortality effect fertility rates .",0
400,"This article estimates causal impact land mines child health Angola , controlling conflict exposure . Our identification strategy based geography Angolan civil war . We posit distance communes rebel headquarters exogenous driver land mine contamination . We find land mine intensity positively correlated distance set rebel headquarters . Instrumental variables estimates , based two household surveys Landmines Impact Survey , indicate land mines large negative effects weight-for-age height-for-age . We discuss results respect costs benefits land mine clearance , well long-term costs early malnutrition . We also compare magnitude estimates related studies impact conflict child health .",0
401,"Using rich longitudinal data set , examine relationship teen fertility subsequent educational outcomes HIV-related mortality risk rural South Africa . Human capital deficits among teen mothers large significant , earlier births associated greater deficits . In contrast many studies developed countries , find clear evidence selectivity teen childbearing either schooling trajectories prefertility household characteristics . Enrollment rates among teen mothers begin drop period immediately preceding birth , future teen mothers behind schooling relative girls . Older teen mothers ahead school age prebirth likely continue schooling birth . In addition adolescents ' higher biological vulnerability HIV infection , pregnancy also appears increase risk contracting HIV . Following women extended period , document higher HIV-related mortality risk teen mothers explained household characteristics early adulthood . Controlling age sexual debut , find teen mothers report lower condom use older partners sexually active adolescents .",0
402,"Although access quality education rural China expanded dramatically past 3 decades , significant disparities persist ethnic minorities Han majority . This article compares academic achievement determinants achievement minority Han students rural western China . In survey nearly 21,000 primary school students , find minority students score significantly lower Han peers standardized exams math Chinese . This Han-minority achievement gap largest minority students whose primary language standard Mandarin ( putonghua ) : students score average 0.6 standard deviations lower Han students subjects . For minority students whose primary language standard Mandarin , gap Han students almost fully explained different endowments student , class peer , teacher , school characteristics . Endowments characteristics , however , explain little achievement gap non-Mandarin minority students . A fixed effects analysis also shows returns Han students attending individual schools tend larger minority students similar characteristics . Further , school-specific differential returns Han minority students strongly associated characteristics teachers .",0
403,"We offer new conceptual insights understanding occupational choice uncertain rural environments , focus ex ante ( shock ) ex post ( shock ) consequences farmers belonging different portions asset distribution . We model theoretically choice relatively safe subsistence farming , higher return higher risk cash crop activities , off-farm labor -- conditional preexisting asset allocation -- look general equilibrium labor market implications correlated shocks . Our results , backed evidence Malawi , challenge stylized perceptions literature consumption smoothing via off-farm labor supply .",0
404,"Although thousands studies developing countries evaluated whether specific interventions improve educational outcomes disadvantaged students , focused comprehensive reforms . The goal study examine comprehensive package demand- supply-side educational interventions -- namely , building free , elite high schools targeted toward students poor areas -- affects educational outcomes disadvantaged students . Specifically , use unique administrative data set includes information students one northwestern province China 10 years , combination short interrupted time series comparison group designs , estimate causal effects intervention college admission outcomes students poor areas . Our results show intervention improves likelihood `` typical '' ( average ) student poor area gain admission nonelite colleges elite colleges . Furthermore , discussing mechanisms intervention improve ( nonelite ) college admission outcomes typical student , argue expanding capacity existing high schools may cost-effective option building new elite high schools .",0
405,"This study evaluates large social protection program rural Ethiopia , Productive Safety Net Programme ( PSNP ) . The effectiveness PSNP interest program implemented scale one Africa 's poorest countries , limited physical communications infrastructure scarce administrative resources . Using longitudinal survey data collected 2006 , 2008 , 2010 household locality levels , employ extension propensity score matching method continuous treatments estimate impact transfers PSNP separate program household food security . Against formidable background rising food prices widespread drought , participation Public Works component PSNP modest effects . The PSNP reduced length last hungry season 1.29 months among households received transfers 5 years compared eligible households received almost nothing . Five years participation raises livestock holdings 0.38 tropical livestock units relative receipt payments 1 year . There evidence PSNP crowds private transfers . The joint impact access PSNP along program helps households increase agricultural income build assets even higher . Having programs reduced length last hungry season 1.5 months per year increased livestock holdings 0.99 tropical livestock units .",0
406,"The aim article understand functioning individuals ' health-seeking behavior . It studies , theoretically empirically , whether individuals change health care providers time , depending health outcome ( i.e. , healed sick ) consultation previous caregiver . Results show previous health outcome plays crucial role shifting individual preferences particular type medical care . I find patients healed seeking health care likely seek care future . Furthermore , conditional seeking care , individuals likely return formal ( informal ) health providers experienced previous history cures switch away formal ( informal ) caregivers negative outcome . I interpret results learning clinicians ' quality time . The effects tested using 4-year panel data household survey Tanzania .",0
407,"Using census data Nepal examine partial derivatives predicted household welfare vary parental education . We focus fertility , child survival , schooling , child labor . Female education strongly associated beneficial outcomes often assumed . Male education often matters , part association female education welfare driven marriage market matching educated men . Controlling average education parental cohorts change finding . But use educational rank proxy unobserved ability family background , positive association female education beneficial outcomes becomes weaker reversed . For women , association educational rank outcomes strong : women obtain schooling peers school fewer children educate better . In contrast , men statistical association education household welfare remains strong , even control educational rank within birth cohort .",0
408,"We estimate informal-formal sector pay gap throughout conditional wage distribution using panel data Brazil , Mexico , South Africa . We control time-invariant unobservables , identification stems intersector movers . We control observables nonlinear way using propensity score reweighting carefully check potential measurement errors . Using similar definitions informality , obtain consistent results three countries : informally employed workers earn much less formal workers primarily lower observable unobservable skills . Estimates conditional wage gap show also underpaid compared formal sector counterparts . In three countries , informal wage penalty larger lower part conditional distribution tends disappear top ( i.e. , informal sector increases wage dispersion ) . The magnitudes effects vary across countries , largest penalties lower conditional quantiles South Africa modest wage gaps Latin America . We suggest explanations line different legal labor market conditions .",0
409,"In early 1990s , China began opening urban water sector nonstate capital meet increasing urban water demand . By 2007 , 30 % large medium urban water utilities attracted private sector participation ( PSP ) , two thirds majority nonstate shareholders . To understand factors drive PSP urban water supply answer key policy question PSP affected water utility performance , assemble analyze unique data set consisting 208 urban water utilities servicing 300 million urban residents 1998 2007 . We find utility 's profitability liability level host city 's road infrastructure prior year play important roles driving private investors enter withdraw sector . It found PSP utilities , mainly majority nonstate shareholders , made substantial cost savings employment downsizing cutting managerial expenses , leads remarkable profit increase . Other estimates , although statistically insignificant , show PSP increases utility 's investment efficiency , PSP cities lower total domestic water supply domestic water users .",0
