Unnamed: 0,abstract,top_journal
728,"This paper uses panel regression techniques assess policy determinants private sector innovative activity ? proxied R & D ; expenditure number new patents ? across 19 OECD countries . The relationship innovation indicators multifactor productivity ( MFP ) growth also examined particular focus role public policies influencing returns new knowledge . The results establish empirical link R & D ; patenting , well measures innovation intensity MFP growth . Innovation ? specific policies R & D ; tax incentives , direct government support patent rights found successful encouraging innovative activities associated higher productivity growth . However , direct empirical evidence positive effects policies productivity less forthcoming . A pervasive theme analysis importance coupling policies aimed encouraging innovation technological adoption well designed framework policies allow knowledge spillovers proliferate . In particular , settings framework policies relating product market regulation , openness trade debtor protection bankruptcy provisions found important diffusion new technologies .",0
729,"This paper outlines tax policy details 26 OECD countries 1980 2006 provides summary quantitative measures relative generosity . Separate measures after-tax cost labour , current expenditure , machinery equipment buildings structures presented also measure tax policy applicable multinational subsidiaries undertaking R & D ; behalf parent firm . The purpose working paper make data available researchers .",0
730,"Economists political scientists argued differences risk civil conflict across countries time may partly reflect differences opportunity cost participating civil conflicts . One way test opportunity-cost channel examine civil conflict risk following transitory income shocks . In paper I propose two instrumental-variables approaches estimate effect transitory income shocks civil conflict risk . I also show approaches tailored transitory income shocks may lead conclusion negative income shocks increase risk civil conflict - would seem consistent opportunity-cost channel - actually lower civil conflict risk . I illustrate issues revisiting Miguel , Satyanath , Sergenti 's ( 2004 ) conclusion negative income shocks increase risk civil conflict Subsaharan Africa .",0
731,"We empirically characterise good labour relations alleviate negative impact productivity regulatory constraints workforce opposition . The estimates based unique survey French manufacturing firms collected Banque de France period 1991-2008 . Our main results may summarised follows : ) ?workforce union opposition? interacted ?regulatory constraints? negative significant impact total factor productivity ( TFP ) . When interaction taken account , deteriorated labour climate , workforce union opposition , weighs directly TFP . But interaction taken account , negative impact relies solely combination regulatory constraints labour opposition : workers unions successfully oppose management?s decisions weigh TFP use threaten use appropriate regulation ; otherwise , opposition may harmless ; ii ) ?regulatory constraints? interacted ?branch firm agreement? positive significant impact TFP . These agreements , obtained labour relations supportive , would used firms offset negative impact regulatory constraints . This favourable impact obtained two channels : first , informally , good labour climate lead flexible implementation regulation ; second , formally , French labour code incorporates provisions allow firm branch agreements adapt even alleviate constraints regulation . These results emphasise implementation regulatory constraints impact productivity crucially hinges quality labour climate .",0
732,"Implementation fiscal consolidation advanced economies coming years needs take account short long-run interactions economic growth fiscal policy . Many countries must reduce high public debt GDP ratios penalize long-term growth . However , fiscal adjustment likely hurt growth short run , delaying improvements fiscal indicators , including deficits , debt , financing costs . Revenue expenditure policies also critical affecting productivity employment growth . This paper discusses complex relationships fiscal policy growth short long run .",0
733,"This note analyzes model endogenous fertility presence financial market assets social security pensions . Given children externality , fertility rate chosen market economy low compared Social Optimum , asking corrective policy . Indeed , representative household take account children externality leads suboptimal family size . We show optimal demographic allocation implemented subvention taxation policy .",0
734,"paper identifies major political economic constraints impact demand-side electricity industry re-structuring processes . These constraints major barrier implementing effective restructuring processes many countries , particularly developing world . The paper describes constraints addressed harmed market efficiency system reliability using examples re-structuring processes around world . The paper proposes demand-side regulatory interventions manage constraints manner limits harm wholesale market efficiency . Finally , specific regulatory inventions developing countries proposed .",0
735,"French urban public transport industry , operations often delegated periodically put tender . Thus , operators? incentives reduce costs come profit maximization current contract perspective contract renewal . We construct dynamic incentive regulation model captures features show level cost-reducing effort repartition contracting period depend contract type ( cost-plus , gross cost net cost contract ) . We estimate cost frontier model eight-year panel French bus companies ( 664 company-year observations ) test predictions .",0
736,"International patenting activity source international technology diffusion . However , technology diffuses imperfectly technology gaps exist nations . Indeed patenting activity largely concentrated developed countries . A gap also exists patent protection levels across countries , weak largely developing countries . Hence paper studies extent strengthening harmonization patent rights would stimulate international patenting help narrow technology gaps . International total factor productivity ( TFP ) differences used measures technology gaps . The paper develops estimates model international patenting TFP behavior using panel data set 44 countries , developed developing , period 1975 - 2005 . Of countries , 25 serve ?source countries? ( i.e. , source technologies ) . Overall , however , paper finds international patent reforms ( even involve major regime changes ) relatively modest effects technology gap developed developing nations .",0
737,"Can poverty decline little growth real GDP ? This paper examines case Jamaica , poverty headcount halved 2003 2007 despite real per capita GDP growth 1.1 percent per year , analyzing factors contributing observed reduction poverty using household labor force surveys . It sets providing sectoral , demographic , spatial picture evolution poverty finds poverty reduction broad based , benefitting rural urban areas . Nearly three quarters poverty reduction attributed growth average household consumption , outpaced GDP growth due large remittance inflows , one quarter narrowing inequality . In turn , around half reduction inequality explained narrowing returns education declining sectoral wage gaps .",0
738,"I examine effect labour market policies institutions transmission macroeconomic shocks labour market , using aggregate industry-level annual data 23 OECD countries , 23 business-sector industries 29 years . I find high progressive labour taxes generous unemployment benefits amplify labour income fluctuations . By contrast , statutory minimum wages reduce difference sensitivity wages aggregate shocks low-wage high-wage industries . Dismissal regulations found mitigate impact shocks earnings employment . Moreover , mitigation effect greater industries firms greater propensity make staffing changes dismissals .",0
739,"This paper searches determinants government-funded R & D . ; The goal disentangle whether efficiency considerations overwhelmingly emphasized theoretical literature indeed main driving force behind public R & D ; expenditures . Another goal paper assess whether types innovation policy degree patent protection impact private R & D . ; I find important differences rich poor nations respect . In particular , R & D-specific ; efficiency factors significant explain public R & D ; rich nations , whereas related variables access private credit important less developed economies ; rich countries , public innovation effort better explained political economy variables determine size governments . Private R & D ; , hand , depends high income economies R & D ; policies related direct public innovation effort , highly determined variable developing countries . Results suggest research political economy theories innovation essential understand R & D ; investment .",0
740,"The quality contracting institutions thought second-order importance next impact good property rights institutions long-run growth . Using large range proxies type institution , find robust negative link quality contracting institutions long-run growth condition property rights number additional macroeconomic variables . Although result remains something puzzle , present evidence suggests property rights institutions good contracting institutions appear also good development . Good contracting institutions reduce long-run growth property rights secured , presumably gains ( costly ) contracting institutions realised . This suggests contracting institutions benefit growth , sequence institutional change matter .",0
741,"In study test ?power? aggressiveness various journal weighting schemes , especially based recursive adjustment methodology first developed Liebowitz Palmer . Using data generated New Zealand?s academic economists , provide quantitative measures differences recursive adjustment-based schemes selected alternatives . We compare performance economics departments journal weighting schemes , comparison purposes , one based direct citation counts . We find departmental rankings based selected recursive adjustment schemes relatively stable , rankings differed substantially generated alternative schemes . This suggests departmental hiring practices research strategies must sensitive type funding scheme employed . In particular , research domestic regional issues likely unattractive researchers high-powered journal weighting scheme adopted ?official? standard since regional journals , natural outlet work , frequently zero-weighted schemes .",0
742,"The single currency expected make national balance payments irrelevant euro-area members . From 2010 onwards , however , governments , also banks non-financial companies several euro-area countries difficulty getting access non-resident financing . Assessing whether balance-of-payment crisis looking current-account developments flawed approach case countries receive significant official support assistance programmes Eurosystem central banks . In paper document evolution private capital flows formally test existence ?sudden stops? . We find Greece , Ireland , Italy , Portugal Spain experienced significant private-capital inflows 2002 2007-09 , followed unambiguously massive outflows qualify ?sudden stops? . The timeline suggests contagion effects present . We document substitution private capital flows public flows . In particular , show ( weak ) banks distressed countries took major share central bank refinancing , thereby contributing build-up intra-Eurosystem net balances . The evidence euro area subject internal balance-of-payment crises taken strong signal weakness invitation systemic reform .",0
743,"This paper role policy , institutions , culture creating strong negative tradeoff productivity employment growth across groups countries within Europe . Throughout postwar era 1995 labor productivity grew faster Europe United States . In decade 1995 , productivity growth EU-15 slowed US accelerated . Europe?s productivity growth slowdown largely offset faster growth US employment per capita , leaving little difference growth output per capita EU US going back 1980 . We document productivity-employment tradeoff raw data , regressions control two-way causation productivity employment growth , show robust negative correlation productivity employment growth across countries time . We find negative effect changes employment per capita changes productivity robust alternative instruments inclusion exclusion particular countries like Italy Spain . We conclude suggesting evaluations alternative policy reforms Europe take account offsetting effects employment productivity examining ultimate impact changes income per capita .",0
744,"The available evidence effects aid growth notoriously mixed . We use novel empirical methodology , heterogeneous panel vector-autoregression model identified factor analysis , study dynamic response exports , imports , per capita GDP growth ?global? aid shock ( common component individual country aid-to-GDP ratios ) . We find estimated cumulative responses exports per capita GDP growth global aid shock strongly positively correlated , responses inversely related exchange rate overvaluation measures . We interpret evidence consistent Dutch disease hypothesis . However , also find , countries less overvalued real exchange rates , exports per capita GDP growth respond positively global aid shock . This evidence suggests preventing exchange rate overvaluations may allow aid-receiving countries avoid Dutch disease .",0
745,"Multilateral development banks sometimes thought engage `` defensive lending '' -- practice extending new loans purely order ensure existing loans repaid . We empirically examine hypothesis using data lending extended repayments International Development Association ( IDA ) , largest multilateral provider concessional development loans low-income countries . We argue key institutional features IDA ( ) potentially create incentives defensive lending also ( ii ) enable particularly sharp tests defensive lending hypothesis . We find surprisingly robust partial correlation disbursements new IDA loans repayments existing loans . However , closer look evidence suggests defensive lending unlikely major explanation relationship .",0
746,"This paper assesses impact mobile phone rollout economic growth sample African countries 1988 2007 . Further , light large financial infrastructure gap African countries , investigate whether mobile phone development fosters economic growth better financial inclusion . In estimating impact mobile phone development growth , use mobile penetration rate well cost mobile local calls capture mobile phone diffusion , financial inclusion measured number deposits loans per head . Using System Generalized Method Moments ( GMM ) estimator address endogeneity issues , results confirm mobile phone development contributes significantly economic growth African countries . Part positive effect mobile phone penetration growth comes greater financial inclusion .",0
747,"The regulation network industries undergone profound transformation past twenty years . The regulated industry longer , exposed new competitive dynamics revolutionized industrial framework , technology interactions users . There also fundamental changes regulation feasible . In ?information society? model devised 19th century set prices monopoly infrastructures bridges , roads railways longer captures essential : interactive dynamics created technologies , uses , markets .",0
748,"The dynamic general equilibrium model hiring costs presented paper delivers involuntary unemployment steady state well involuntary fluctuations unemployment . The existence hiring frictions introduces externalities , turn , entail breakdown ?divine coincidence? without assuming real wage rigidity . We able show model labour market imperfections outperforms standard New Keynesian model persistence responses monetary shocks . We also attempt analysis volatility two economies , differing ?degrees imperfection? . It turns ?rigid? economies exhibit less unemployment volatility inflation volatility ?flexible? economies .",0
749,"This study investigates impact international outsourcing low high income countries total factor productivity ( TFP ) growth based manufacturing industry data 14 OECD countries period 1995-2000 . We find broad narrow measure international outsourcing material inputs low income countries significantly related total factor productivity growth . In contrast , significant impact purchased services abroad TFP growth . In particular , purchased services abroad account 20 percent total factor productivity growth manufacturing sector selected OECD countries .",0
750,"Public-Private Partnerships ( PPPs ) widely advocated flexible contractual solutions enabling public sector profit private firms? innovative solutions providing additional ( possibly increasing infrastructural stock ) valuable public services . Recently , however , practitioners academics alike cast doubts possible opportunistic use PPPs : instead efficient option fill infrastructural gaps across different social economic areas , PPPs may employed privileged way face periods fiscal consolidation tight budget . In order shed light suspicion , construct original dataset containing PPPs? tender notice information , budget results Italian Municipalities aggregated provincial level , per capita wealth , indexes infrastructural stocks morpho-demographic information local areas . Our findings highlights ) feeble linkage decision deploy PPP existence infrastructural gap , ii ) strong relationship number deployed PPP procedures local budgetary results .",0
751,"Debt sustainability vexing issue . Its importance immediately obvious escapes easy definition . This situation unheard economics ; price stability full employment examples crucially important policy objectives simply defined . Yet , price stability full employment measured reasonable degree precision , debt sustainability even measured directly .",0
752,"This paper assesses non linear impact external debt growth using panel data 93 developing countries . The estimates support non-linear , hump-shaped , relationship debt growth , especially debt burden measured relative GDP . For country average indebtedness , doubling debt ratio reduces growth third half percentage point controlling endogeneity . Our findings also suggest average impact debt becomes negative 160?170 percent exports 35?40 percent GDP marginal impact debt half values .",0
753,"It argued new actor emerging international business , dubbed ?Social Multinational? , blend international rent-creation pursuit social objectives . However , would misleading state emergence Social Multinationals natural outcome market driven process . Too much left understanding sensitiveness individual entrepreneurs . Signals emergence new promising breed still weak . Important institutional innovations enacted favour strengthening growth .",0
754,"We estimate euro effect export patterns using panel industry data Ireland period 1993-2004 . Our main innovation account country industry specific omitted trending variables bias . We find euro effect Irish exports euro area countries relative rest trading partners Ireland positive , significant increasing since 2000 . Furthermore , find heterogeneous euro effects across industries . We find consistent significant positive euro effects industries characterised increasing returns scale .",0
755,"Relying comprehensive dataset including detailed information patent applications filed EPO 1980 2000 renewal granted , paper presents first survival time analysis determinants patent length . The results twofold : first , clearly establish life expectancy patent rights significantly increased past decades despite small decline average grant rate . Second , show filing strategies strongly influence overall length patents , possibly due induced delays examination process . This suggests strategies may result higher longer lasting legal uncertainty markets , unknown consequences dynamic efficiency patent system .",0
756,"We use census data examine impact industrialization children?s education Mexico . We find evidence reverse causality case . We find small positive effects industrialization primary education , effects larger domestic manufacturing export-intensive assembly ( maquiladoras ) . In contrast , teen-aged girls Mexican counties ( municipios ) growth maquiladora employment 1990-2000 significantly less educational attainment girls low-growth counties . These results shed light literatures analyzing impacts industrialization , foreign investment , intra-household bargaining power .",0
757,"The paper first summarizes theoretical empirical literature growth inequality impact liberalization trade , FDI , portfolio flows , migration . It compares inequality growth performance Latin America 2000-2008 recorded period fast liberalizing European economies transition . The paper argues latter recorded growth rates GDP slightly higher Latin America , experienced also greater instability rise income inequality instead declined Latin America . The paper suggests divergent performance mostly explained differences policies .",0
758,"Institutions widely believed important explaining performance . In paper , analyze whether commonly used measures institutions significant , measurable impact performance , whether countries firms . We look three ?levels? institutions associated conjectures . The first concerns whether political system affects performance . The second concerns whether business investment environment affects performance countries third concerns whether perceived business constraints directly affect performance firms . In instances , find little evidence robust link widely used measures institutions indicators performance . We consider might case argue mis-measurement , mis-specification , complexity non-linearity relevant factors .",0
759,The relationship trade institutions extensively debated trade economists political scientists . The aim present paper provide empirical evidence causal relationship institutions trade flows panel framework . We present Granger causality test ( 1969 ) well Hurlin Venet ( 2001 ) test panel data using bilateral trade flows panel covers 29 years . The issue zero flows trade handled using panel Poisson Pseudo-Maximum Likelihood estimator .,0
760,"This paper investigates co-authorship network star researchers different disciplines work social capital . There recent surge interest social capital . Articles social capital published last five years constitute 60 percent articles social capital . Research social capital spans sociology , economics , management , political science health sciences . Despite interest still consensus definition measurement social capital . This partially due lack interaction disciplines . By employing simple social network analysis paper shows social capital social capital researchers low disciplines . Different theories capital , social capital theory concurrently developed various disciplines , research across disciplines improve understanding social capital .",0
761,"This paper revisits relationship health growth light modern endogenous growth theory . We propose unified framework encompasses growth effects rate improvement health level health . Based cross-country regressions period 1960-2000 , instrument variables , find higher initial level higher rate improvement life expectancy significantly positive impact per capita GDP growth . Then , restricting attention OECD countries , find supportive evidence reduction mortality age forty generates productivity gains , turn may explain positive correlation health growth cross-OECD country regressions appears weakened since 1960 .",0
762,"This paper investigates whether adoption Euro facilitated introduction structural reforms , defined deregulation product markets liberalization deregulation labor markets . After reviewing theoretical arguments may link adoption Euro structural reforms , investigate empirical evidence . We find adoption Euro associated acceleration pace structural reforms product market . The adoption euro seem accelerated labor market reforms ?primary labor market? ; however , run Euro adoption seems accompanied wage moderation . We also investigate issues concerning sequencing goods labor market reforms .",0
763,"This paper assesses sustainability global imbalances testing presence unit roots current account positions ( measured relation GDP ) United States , China , Japan , Germany oil-exporting countries using methodology allows structural breaks levels trends . We find external positions major countries/regions stationary around structural breaks , define episodes current account reversals . On basis event analysis past reversals , appears structural breaks associated shifts fiscal stance , exchange rate parities potential output growth , finding underscores scope macroeconomic structural policies ensure sustainability external positions avoiding potentially disruptive reversals . These findings implications long-term capital flows crisis .",0
