Unnamed: 0,abstract,top_journal
0,"We conducted six treatments standard moral hazard experiment hidden action . All treatments identical Nash equilibria . However , behavior treatments periods inconsistent established agency theory ( Nash equilibrium ) . In early periods experiment , behavior differed significantly treatments . This difference largely vanished final periods . We used logit equilibrium ( LE ) device grasp boundedly rational behavior found following : ( 1 ) LE predictions much closer subjects? behavior laboratory ; ( 2 ) LE probabilities choosing strategies experimental behavior show remarkably similar patterns ; ( 3 ) profit ? maximizing contract offers according LE close derived regressions . ( This abstract borrowed another version item . )",0
1,"This paper analyzes blindfolded versus informed ultimatum bargaining proposer responder either uninformed informed size pie . Analyzing transition one information setting suggests information induces lower ( higher ) price offers acceptance thresholds pie small ( large ) . While experimental data confirm transition effect , risk aversion leads diverging results blindfolded ultimatum bargaining due task-independent strategies 'equal sharing ' 'golden mean . ' The probability successful bargaining lower case blindfolded informed ultimatum bargaining . ( This abstract borrowed another version item . )",0
2,"We analyze drivers size audience number questions asked parallel sessions annual conference German Economics Association . We find location presentation least important number academics attending talk combined effect person presenting paper presented . Being presenter late morning session second day conference , close place coffee served , significantly increases size audience . When comes asking questions , location becomes less important , smaller rooms lead questions asked ( women ) . Younger researchers well senior researchers attract questions comments . There also interesting gender effects . Women attend research sessions diligently men , seem ask fewer questions men . Men less likely attend presentations health , education , welfare , development economics women . Our findings suggest strategic scheduling sessions could ensure better participation conferences . Moreover , different behaviors men women conferences might also contribute lack women senior scientist positions . ( This abstract borrowed another version item . )",0
3,"Japan benign liquidity trap since 1990 . In benign liquidity trap , interest rates approach zero , prices decline , monetary policy ineffective output employment perform decently . Such pattern contradicts traditional macro theories . This paper introduces monetary general equilibrium model compatible Japan´s performance resolves puzzles associated liquidity traps . Possible conclusions Anglo-Saxon countries eurozone members also discussed . ( This abstract borrowed another version item . )",0
4,"This paper addresses tax loopholes allow firms exploit borderline cases legal tax avoidance illegal tax evasion . In general , tax loopholes detrimental revenue-maximizing government . This may change presence corruption tax administration . Tax loopholes may serve separating mechanism helps governments maximize revenues curb corruption , may explain developing countries gradually close loopholes tax codes . ( This abstract borrowed another version item . )",0
5,"Single parents unmarried couples increasingly replacing traditional nuclear family . This paper investigates greater variety living arrangements contributes increased resource disparities among children Germany . Children single parent families disadvantaged least three dimensions decisive later achievements : material standard living , parental education , parental childcare time . We compute multidimensional inequality poverty indices using SOEP data 1991-2012 . We distinguish parental publicly provided childcare , increasingly important in-kind benefit Germany . We find multidimensional inequality poverty declined expanded public childcare strongly reduces resource disparities among children . ( This abstract borrowed another version item . )",0
6,"Most countries show residency discount rents sitting tenants . In wake strong rent increases housing shortages , Germany implemented reform 2001 curtail rent increases . Based linked housing-tenant data Germany , paper estimates panel OLS quantile regressions rents within tenancies . The results show rents deflated CPI increase strongly 1984 reform 2001 , reversal trend afterwards . Before reform , significant residence discount decreases absolute value tenure . The reform reduces rents , particular expensive apartments new leases . There residency discount reform . ( This abstract borrowed another version item . )",0
7,"This study estimates earning losses workers experiencing involuntary job separation . We employ , first time earning losses literature , Poisson pseudo-maximum-likelihood estimator fixed effects several advantages respect conventional fixed effects models . The Poisson estimator allows considering full set involuntary separations , including zero labor market earnings unemployment . By including individuals zero earnings using new method , loss year separation becomes larger previous studies . The loss starts roughly 30 percent , although quickly shrinks , remains around 15 percent following years . In addition , find compared reasons separation , earning loss pattern unique involuntary separations , type separation implies permanent scarring . This latter finding makes us confident self-reported involuntariness separation reliable source information . ( This abstract borrowed another version item . )",0
8,"As long employed cautiously enough , model approach useful tool estimate simultaneously size development shadow economy several countries . However , second method necessary calibrate model . The currency demand approach lead highly implausible results ; size shadow economy might largely overestimated . An alternative survey method . For real tests whether variable impact , procedures necessary use variables used construct indicator . Thus , make progress analysing shadow economy , model approach role play , complemented methods employing different data . The currency demand approach used long employs variables constructions . ( This abstract borrowed another version item . )",0
9,"Considerable experimental evidence collected rules enhancing contributions public goods dilemmas . These studies either confront subjects pre-specified rules subjects choose different rule environments . In paper , completely endogenize institution design process asking subjects design repeatedly improve rule sets public goods problem order investigate rules social planners facing social dilemma â??inventâ? rules develop time . We make several noteworthy observations , particular strong successful use framing , concealment individual contribution information decreasing use punishment . ( This abstract borrowed another version item . )",0
10,"We study subjects experiment use different forms public information opponents ' past behavior . In absence public information , subjects appear use rather detailed statistics summarizing private experiences . If additional public information , make use information even less precise private statistics ? except high stakes . Making public information precise two consequences : It also used stakes high reduces number subjects ignore information ? public private . That , precise public information crowds use information . Finally , results shed light unraveling centipede games . ( This abstract borrowed another version item . )",0
11,"In paper study optimal choices self-selection politics commitment office part citizens heterogeneous abilities heterogeneous motivations . Politicians moonlight , i.e. , work market sector appointed parliament . Our theoretical framework shows high-ability citizens may enter politics . Yet high-ability non-motivated ( market-fit ) politicians likely shirk , high-ability motivated ( public-fit ) ones committed parliamentary activity . We test predictions using unique database Italian parliamentarians period 1996-2006 . We find evidence advantageous selection market-fit public-fit politicians display pre-election income greater Italian population . We also show commitment market-fit parliamentarians terms voting attendance negatively affected income opportunities , whilst case public-fit ones . ( This abstract borrowed another version item . )",0
12,"This paper studies influence interregional inequality within countries internal con-flicts . Regional inequalities measured population-weighted coefficient variation regional GDP per capita . As main innovation , I use panel data set country-level re- gional inequalities , covers 56 countries ( 835 subnational regions ) 1980 2009 . I also consider broader cross-section data set year 2005 , covers 110 countries ( 1569 subnational regions ) . Conflict measured incidence civil war ( UCDP/PRIO data ) risk measure internal conflict ( war , terrorism , riots ) provided PRS Groupâ??s International Country Risk Guide . Logit estimations employed well OLS fixed effects panel regressions . I find regional inequalities increase risk internal conflict . ( This abstract borrowed another version item . )",0
13,"To counteract financial pressure emerging aging societies , statutory pay-as-you-go pension schemes undergoing fundamental reforms many Western countries . Starting cohort 1937 , Germany introduced permanent pension deductions early retirement . This paper examines evolution profitability pension contributions background reform cohorts 1935-1945 . I measure profitability internal rate return ( IRR ) use high quality administrative data . For men IRR declines 2.4 % 1.2 % women 5.2 % 3.7 % . The results suggest deductions introduced reform cause part trend . The majority trend , 75 % -80 % , caused increased pension contributions . ( This abstract borrowed another version item . )",0
14,"In 2009 new law German debt brakes passed : state governments allowed run structural deficits 2020 . Consolidation strategies initiated today influence state comply debt brake 2020 . We describe extent government ideology predicts state governments consolidate budgets fiscal adjustment path choose . Attitudes towards budget consolidation , expressed politiciansâ?? words public debate , differed among parties . Anecdotal evidence descriptive statistics indicate leftwing governments ran average higher structural deficits rightwing governments 2010 2014 . Primary deficits , however , hardly differed leftwing rightwing governments . Revenues federal taxes much higher expected facilitated budget consolidation . Leftwing governments need run deficits design generous budgets . It conceivable parties confirmed identity using expressive rhetoric , responded shifts public opinion financial crisis pursued sustainable fiscal policies office . ( This abstract borrowed another version item . )",0
15,"In study , I provide evidence educational achievement second-generation immigrants German-speaking Switzerland greater Germany . The impact first-generation immigrantsâ?? destination decision offspringâ??s educational achievement seems much important recognized existing literature . I identify test score gap students explained differences individual family characteristics . Moreover , I show gap evolves test score distribution least favorably-endowed students fare . My results suggest educational system Switzerland , relative German system , enhances performance immigrantsâ?? children substantially . This disparity largest conditioning language spoken home , prevails even comparing students whose parents migrated country origin . ( This abstract borrowed another version item . )",0
16,The paper estimates NAIRU Phillips curve relationship state-space framework . To identify inflation-unemployment trade-off account time-varying inflation trend control part inflation affected cyclical component unemployment . In addition use shifts relative volatility shocks unemployment inflation address simultaneity problem Phillips curve estimations . Applying method Rigobon Sack ( 2003 ) allows data driven identification contemporaneous coefficients unemployment gap Phillips curve yields precise estimates structural coefficients Phillips curve . This tightens economic relation basis NAIRU derived . ( This abstract borrowed another version item . ),0
17,"Victimization poorly studied topic economic research . This paper considers economic factors victimization using individual data . It tests rational-choice-based hypothesis attractive poorly guarded targets facing higher risk victimization . The used dataset also covers criminal activities individual offending behavior studied endogenous driver victimization . Econometric results confirm criminal background one major reasons victimization . In line rational choice behavior offenders , victimization also associated job holder schooling . Moreover , large peer groups increase risk victimization , whereas married healthy people significantly lower risk becoming crime victim .",0
18,"This article studies effects tax competition provision public goods business risk partial irreversibility investment . As shown , provision public goods changes time also depends business cycle . In particular , source-based taxation , short term , public goods optimally provided downturn . The converse true recovery : case , underprovided . In long term , however , tax competition affect capital accumulation . This means provision public goods unaffected taxation .",0
19,"With direct incentives sanctions common instruments fight tax evasion , theoretical literature tended overlook indirect schemes , itemised deductions , one agent 's behaviour affects likelihood others declare revenue . Itemised deductions provide incentive consumers declare purchases . This induces partial shift demand black market legal one , consumers need transaction receipt enjoy tax deduction . I show possible increase tax proceeds choosing suitable level itemised deduction , , level taxation . Indeed , cost tax authority consumers ' side compensated extra proceeds generated sellers ' side .",0
20,"During episodes increased global risk aversion , risk-off episodes , safe currencies Swiss franc tend appreciate . The immediate impact risk-off shock increase net private inflows Switzerland , mostly driven reduction Swiss residents? net purchases foreign debt securities reduced foreign exposure Swiss banks . Given bulk capital movements related risk-off episodes driven decisions Swiss residents , capital flow management policies discriminate based residency investor ( capital controls ) likely effective reducing impact risk-off episodes . However , prudential policies limit leveraging foreign exposure Swiss banks may diminish volatility capital flows risk-off episodes .",0
21,"This paper analyzes impact migration destination-country corruption levels . Capitalizing comprehensive dataset consisting annual immigration stocks OECD countries 207 countries origin period 1984?2008 , explore different channels corruption might migrate . We employ different estimation methods using fixed effects Tobit regressions order validate findings . Moreover , also address issue endogeneity using Difference-Generalized Method Moments estimator . Independent econometric methodology , consistently find general migration insignificant effect destination country 's corruption level , immigration corruption-ridden origin countries boosts corruption destination country . Our findings provide profound understanding socioeconomic implications associated migration flows .",0
22,"The model Mehra Prescott ( 1985 , J. Econometrics , 22 , 145?161 ) implies reasonable coefficients risk-aversion economic agents explain equity risk premium generated financial markets . This discrepancy hitherto regarded major financial puzzle . We propose alternative model explain equity premium . For normally distributed returns returns far away normality ( still light tailed ) , realistic equity risk premia imply puzzlingly high risk aversions . Following approach , ?equity premium puzzle? exist . We also consider fat-tailed return distributions show Pareto tails incompatible constant relative risk aversion .",0
23,"This contribution empirically analyzes individual determinants tax rate preferences . For purpose , use representative survey data German General Social Survey , offers information attitudes toward progressive , proportional regressive taxation . On basis theoretical considerations , explore factors , beyond individual 's financial interest , drive preferences progressive taxation . Our empirical results confirm narrow redistributive self-interest offer sole explanation heterogeneity individual attitudes . Rather , show choice favored tax rate also driven fairness considerations beliefs role effort economic success .",0
24,"Language strong robust determinant international trade patterns : Countries sharing common language trade significantly countries using different languages , holding factors constant . In article present first analysis effect language trade intra-national context . Analyzing unique data single-language country , Germany , find similarities local dialect significantly positive impact regional trade . We interpret finding evidence trade-promoting effect culture , linguistic similarities likely reflect cultural ties across regions , rather lower costs communication similar institutions .",0
25,"A high standard security electricity supply comes serious electricity system costs . However , system costs balanced economic costs induced insecure supply electricity . Following macroeconomic approach , analyze economic costs imposed potential power interruptions Germany . Using extensive dataset industries households , estimate Values Lost Load associated hourly costs power interruptions different German regions sectors . We find interruption costs vary significantly time , sectors regions . Peaking midday Monday December 750 Mio ? per hour , average total national outage costs amount approximately 430 Mio ? per hour . A missing gigawatt hour creates average outage costs 7.6 Mio ? .",0
26,"Does matter pays ratings ? Yes , rating agencies? behavior . These findings experiment analyze effect remuneration model rating agencies assessments well investors? issuers? behavior . First , find rating agencies? assessments comparable whether agency ( partially ) paid issuers , investors solely experimenter . Issuers , hand , often return investor 's trust investors pay ratings . Further , investors often act according agencies? recommendations pay information .",0
27,"We examine differences altruism laziness public sector employees private sector employees . Our theoretical model predicts likelihood public sector employment increases worker 's altruism , increases decreases worker 's laziness depending altruism . Using questionnaire data German Socio-Economic Panel Study , find public sector employees significantly altruistic lazy observationally equivalent private sector employees . A series robustness checks show patterns stronger among higher educated workers ; sorting altruistic people public sector takes place within caring industries ; difference altruism already present start people 's career , difference laziness present employees sufficiently long work experience .",0
28,"This study analyzes impact bank relationships firm 's borrowing costs . We find firm 's borrowing costs decrease relationship strength , proxied share bank debt provided lender . Borrowing costs , however , rise relationship length . While increase time weak average , bank-dependent borrowers face substantial premium several relationship years . Switching lender initially leads small price discount average . However , discount considerable borrowers switch strong relationship previous lender . Our results suggest close lending relationships lead benefits firm , may also imply hold-up costs long term .",0
29,"This paper empirically investigates relationship stadium attendance , hooliganism counter-violence policy measures Italian Serie A . In particular , paper analyses impact counter-hooliganism policies adopted 2007 quantity game tickets sold . The counter-hooliganism measures , grounded entry card , namely ?fidelity card? , designed keep hooligans stadiums favouring attendance either occasional spectators uncommitted fans . According econometric investigation expected substitution committed fans uncommitted fans take shape . In sum , ?fidelity card? turn successful evaluated average attendance perspective .",0
30,"We analyse bicameralism affect national fiscal policies federal country vertical horizontal externalities interact . Conditions provided show , equilibrium , two chambers agree disagree choice national capital tax rate , depending whether pivotal voter two chambers .",0
31,"In article , provide simple supply demand framework build-up excessive level leverage result shortage safe assets . On basis , discuss various policy options . First , address question policy-makers shortages safe assets arise . Second , discuss done prevent potential shortages safe assets . Our main finding smoother leverage cycle ? , particular , implies less leverage booms ? major condition preventing shortages safe assets .",0
32,"We empirically investigate potential determinants allowance price dynamics European Union Emission Trading Scheme Phase II . In contrast previous studies , place particular emphasis fuel price selection . We show results extremely sensitive choosing different price series potential determinants , coal gas prices . In general , influence economic activity Europe hydropower provision Norway robustly explaining allowance price dynamics . The influence fuel switching allowance prices , therefore , equalization marginal abatement costs ? particular long run ? still rather small .",0
33,"By 2008/09 school year federal state North Rhine-Westphalia ( Germany ) abolished binding school catchment areas municipalities . The reform controversial feared school choice would increase ethnic segregation . Using data primary schools contribute debate analyzing ethnic segregation reform . We discuss drawbacks commonly used segregation indices interpretation well causality issues . Although increase segregation time period studied , results show segregation affected policy reform .",0
34,"In study , assess accuracy macroeconomic forecasts regional level using large data set quarterly frequency . We forecast gross domestic product ( GDP ) two German states ( Free State Saxony Baden-Württemberg ) Eastern Germany . We overcome problem ?data-poor environment? sub-national level complementing various regional indicators 200 national international indicators . We calculate single-indicator , multi-indicator , pooled factor forecasts ?pseudo-real-time? setting . Our results show significantly increase forecast accuracy compared autoregressive benchmark model , short- long-term predictions . Furthermore , regional indicators play crucial role forecasting regional GDP .",0
35,"Politicians shown benefit electorally attractive physical appearance . Employing data 614 German MPs , note explores whether also affects success/failure market extra-parliamentary activities . An attractive physical appearance found mainly benefit female MPs , especially private-sector jobs . This particularly driven MPs? perceived likability . While MP 's perceived beauty shown direct effects extra-parliamentary activities , findings suggest important indirect effects .",0
36,"The 2005 reform German welfare system introduced two competing organizational models welfare administration . In districts , centralized organization established local welfare agencies bound central directives . At time , 69 districts allowed opt decentralized organization . We evaluate relative success types terms integrating welfare recipients employment . Compared centralized organization , decentralized organization negative effect employment chances males . For women , significant effect found . These findings robust inclusion aspects internal organization common types agencies .",0
37,"We evaluate wage subsidy program targeted long-term unemployed workers Germany . We use alternative identification procedure compared empirical studies conducted far . Exploiting particular program regulations large administrative data estimate impact program availability using regression discontinuity framework . Our results suggest significant impact availability subsidy labor market outcomes target group . Even though analysis lacks statistical power , findings support substantial positive effects obtained matching studies . As approach require observability drivers selection , previous empirical studies justifying government expenditures wage subsidies based matching methods reconsidered .",0
38,"During last decade , German states abolished final year higher secondary schooling keeping academic content almost unaltered . We evaluate effects reform Saxony-Anhalt double cohort graduates 2007 . In 2003 , 13th year schooling eliminated students grade 9 , tenth grade students unaffected . This provides natural experiment analyzing impact schooling achievements educational choice . We find negative effects grades mathematics , effects German literature . Moreover , significant share females found delay university enrollment .",0
